{
  "schemaVersion": 1,
  "evidenceKind": "synthetic",
  "milestone": "M2",
  "workPackages": [
    "M2-W1",
    "M2-W2",
    "M2-W3",
    "M2-W4",
    "M2-W5",
    "M2-W6",
    "M2-W7",
    "M2-W8"
  ],
  "revision": {
    "id": "synthetic-clean-revision",
    "changeId": "kkkkkkkkkkkkkkkkkkkkkkkkkkkkkkkk",
    "dirty": false
  },
  "versions": {
    "minecraft": "26.1.2",
    "neoforge": "26.1.2.78",
    "prism": "synthetic-prism",
    "fixture": "ATM11 0.2.1",
    "java": "synthetic-java",
    "rust": "synthetic-rust",
    "nix": "synthetic-nix",
    "devenv": "synthetic-devenv"
  },
  "environment": {
    "platform": "linux",
    "architecture": "x86_64",
    "hardwareProfile": "synthetic-assembly-host",
    "settings": {
      "scope": "synthetic M2 shape check",
      "budgetProtocol": "m2-loader-budget-v1"
    }
  },
  "inputs": [
    {
      "name": "synthetic-fixture-manifest.json",
      "sha256": "1111111111111111111111111111111111111111111111111111111111111111"
    }
  ],
  "commands": [
    {
      "command": "devenv tasks run ravel:verify",
      "startedAt": "2026-01-01T00:00:00Z",
      "durationMs": 1,
      "exitStatus": 0,
      "logSha256": "2222222222222222222222222222222222222222222222222222222222222222"
    }
  ],
  "tests": {
    "total": 10,
    "passed": 10,
    "failed": 0,
    "skipped": 0,
    "lineCoveragePercent": 100
  },
  "benchmarks": {
    "protocolVersion": "m2-loader-budget-v1",
    "results": [
      {
        "name": "synthetic-loader-overhead.json",
        "sha256": "0000000000000000000000000000000000000000000000000000000000000000"
      }
    ]
  },
  "deviations": [],
  "risks": [
    {
      "summary": "Synthetic non-blocking risk",
      "classification": "non-blocking"
    }
  ],
  "review": {
    "reviewer": "synthetic independent reviewer",
    "independent": true,
    "result": "pass",
    "record": {
      "name": "synthetic-review.md",
      "sha256": "4444444444444444444444444444444444444444444444444444444444444444"
    }
  },
  "attestations": [
    {
      "platform": "linux",
      "architecture": "x86_64",
      "workloads": [
        "vanilla"
      ],
      "statement": "Synthetic M2 shape fixture; it attests nothing about a real launch.",
      "attestedBy": "synthetic operator",
      "attestedAt": "2026-01-01T00:00:00Z"
    }
  ],
  "platformEvidence": []
}
